{
  "id": "mepivacaine",
  "section": "Drug & Dosing Cards",
  "category": "Local Anesthetics",
  "title": "Mepivacaine",
  "settingEmphasis": [
    "or"
  ],
  "aliases": [
    "Carbocaine / Polocaine"
  ],
  "tags": [
    "anesthesia",
    "perioperative",
    "local",
    "mepivacaine"
  ],
  "contentType": "anesthesia-drug-card",
  "content_version": 1,
  "last_reviewed": "2026-09-01",
  "next_review_due": "2026-12-01",
  "review_tier": 1,
  "sources": [
    "AnesCalc v2 drug library (DrugCard.swift), imported 2026-09-01"
  ],
  "changelog": [
    {
      "version": 1,
      "date": "2026-09-01",
      "change": "Imported from AnesCalc v2 DrugCard.swift via tools/import-anescalc.mjs."
    }
  ],
  "brandName": "Carbocaine / Polocaine",
  "drugClass": "local",
  "drugClassLabel": "Local Anesthetic",
  "mechanism": "Amide LA. Intermediate potency and duration. Less vasodilation than lidocaine — intrinsic vasoconstriction gives slightly longer duration without epinephrine.",
  "onset": "Faster than bupivacaine; similar to lidocaine. Infiltration: 3–5 min. Peripheral block: 10–20 min.",
  "duration": "Infiltration plain: 90–150 min. With epi: 3–4h. Peripheral nerve block: 2–5h.",
  "dosing": "Max plain: 5 mg/kg (300 mg). Max with epi: 7 mg/kg (500 mg). Peripheral nerve block: 1–1.5%. Dental: 3% plain or 2% with 1:20,000 levonordefrin.",
  "cautions": [
    "Neonatal toxicity — crosses placenta and slowly metabolized by neonates; avoid in obstetric use",
    "Standard LAST risk profile — monitor CNS/cardiac symptoms",
    "NOT for OB paracervical or epidural (prolonged neonatal half-life)"
  ],
  "pearls": [
    "Good choice for outpatient peripheral nerve blocks — intermediate duration without prolonged motor block",
    "Faster onset than bupivacaine with longer duration than plain lidocaine",
    "Dental anesthesia standard in the US — 3% cartridges widely used"
  ]
}
